{
  "data": [
    {
      "id": "xxxxxxxx-xxxx-xxxx-xxxx-xxxxxxxxxxxx",
      "websiteId": "xxxxxxxx-xxxx-xxxx-xxxx-xxxxxxxxxxxx",
      "browser": "Chrome",
      "os": "Windows",
      "device": "desktop",
      "screen": "1920x1080",
      "language": "en-US",
      "country": "US",
      "createdAt": "2026-01-15T10:00:00.000Z"
    }
  ],
  "count": 100,
  "page": 1,
  "pageSize": 20
}