{
  "data": [
    {
      "id": "xxxxxxxx-xxxx-xxxx-xxxx-xxxxxxxxxxxx",
      "name": "Analytics Team",
      "accessCode": "XYZ789",
      "logoUrl": null,
      "members": [
        {}
      ],
      "createdAt": "2026-01-15T10:00:00.000Z",
      "updatedAt": "2026-01-15T10:00:00.000Z",
      "deletedAt": null
    }
  ],
  "count": 3,
  "page": 1,
  "pageSize": 20
}